{
  "$schema": "../../schema/plugin.schema.json",
  "schemaVersion": 2,
  "runtime": "declarative-feed",
  "id": "com.reddit.subreddit",
  "name": "Reddit",
  "version": "1.0.0",
  "description": "搜索 Reddit 帖子或浏览 Subreddit。使用公开 JSON API，需要登录 Reddit 账号。",
  "homepage": "https://www.reddit.com/",
  "publisher": {
    "name": "Merge examples",
    "url": "https://github.com/EmrysChoo"
  },
  "iconSystemName": "person.3",
  "permissions": {
    "domains": ["www.reddit.com"],
    "maximumResponseBytes": 2097152
  },
  "input": {
    "type": "query",
    "title": "搜索关键词",
    "placeholder": "例如 world news，或 subreddit:worldnews",
    "encoding": "urlQuery"
  },
  "request": {
    "url": "https://www.reddit.com/search.json?q={{input}}&limit=100",
    "method": "GET",
    "headers": {
      "User-Agent": "Mozilla/5.0"
    },
    "cookieFieldID": "session",
    "cookieDomain": "www.reddit.com"
  },
  "configuration": [
    {
      "id": "session",
      "title": "登录 Reddit",
      "type": "webLogin",
      "loginURL": "https://www.reddit.com/"
    }
  ],
  "response": {
    "format": "json",
    "source": {
      "externalID": { "constant": "reddit-search" },
      "title": { "constant": "Reddit" },
      "homeURL": { "constant": "https://www.reddit.com/" }
    },
    "items": {
      "jsonPath": "data.children",
      "externalID": { "jsonPath": "data.id", "required": true },
      "url": { "jsonPath": "data.permalink", "required": true },
      "title": { "jsonPath": "data.title", "required": true },
      "author": { "jsonPath": "data.author" },
      "publishedAt": { "jsonPath": "data.created_utc", "dateFormat": "unix" },
      "summary": { "jsonPath": "data.selftext" },
      "images": { "jsonPath": "data.preview.images.0.source.url" }
    }
  }
}
